{
  "$schema": "https://json-schema.org/draft/2020-12/schema",
  "$id": "https://schemas.stravica.io/rcf/v0.6.0/user-story.schema.json",
  "title": "RCF User Story",
  "description": "User Story document. One file per US. Contains its Acceptance Criteria inline as acceptanceCriteria[].",
  "type": "object",
  "additionalProperties": false,
  "required": [
    "usId",
    "prdId",
    "reqId",
    "version",
    "status",
    "title",
    "asA",
    "iWant",
    "soThat",
    "acceptanceCriteria",
    "createdAt",
    "updatedAt"
  ],
  "properties": {
    "usId": { "$ref": "https://schemas.stravica.io/rcf/v0.6.0/common.schema.json#/$defs/usId" },
    "prdId": { "$ref": "https://schemas.stravica.io/rcf/v0.6.0/common.schema.json#/$defs/prdId" },
    "reqId": { "$ref": "https://schemas.stravica.io/rcf/v0.6.0/common.schema.json#/$defs/reqId" },
    "version": { "$ref": "https://schemas.stravica.io/rcf/v0.6.0/common.schema.json#/$defs/version" },
    "status": { "$ref": "https://schemas.stravica.io/rcf/v0.6.0/common.schema.json#/$defs/authoringStatus" },
    "title": { "type": "string", "minLength": 1 },
    "description": { "type": "string" },
    "asA": { "type": "string", "minLength": 1 },
    "iWant": { "type": "string", "minLength": 1 },
    "soThat": { "type": "string", "minLength": 1 },
    "acceptanceCriteria": {
      "type": "array",
      "minItems": 1,
      "items": { "$ref": "#/$defs/acceptanceCriterion" }
    },
    "tacIds": {
      "type": "array",
      "minItems": 0,
      "items": { "$ref": "https://schemas.stravica.io/rcf/v0.6.0/common.schema.json#/$defs/tacId" }
    },
    "tags": {
      "type": "array",
      "items": { "type": "string" },
      "description": "Free-form tag list. Same shape as req.tags. Consumers may impose local conventions (for example, the rcf-lite blueprint-authoring checklist requires blueprint:<slug> on every US that a blueprint contributes). Optional at schema; absence is not an error."
    },
    "createdAt": { "$ref": "https://schemas.stravica.io/rcf/v0.6.0/common.schema.json#/$defs/timestamp" },
    "updatedAt": { "$ref": "https://schemas.stravica.io/rcf/v0.6.0/common.schema.json#/$defs/timestamp" }
  },
  "$defs": {
    "acceptanceCriterion": {
      "type": "object",
      "additionalProperties": false,
      "required": ["id", "description", "testable"],
      "properties": {
        "id": { "$ref": "https://schemas.stravica.io/rcf/v0.6.0/common.schema.json#/$defs/acId" },
        "description": { "type": "string", "minLength": 1 },
        "given": { "type": "string" },
        "when": { "type": "string" },
        "then": { "type": "string" },
        "testable": { "type": "boolean" },
        "scope": {
          "$ref": "https://schemas.stravica.io/rcf/v0.6.0/common.schema.json#/$defs/scopeTag",
          "description": "Scope at which this acceptance criterion is observable (library, runtime, deployed, unclassified). Optional at schema level; ruleset-enforcing consumers may require it. Governs which test scopes count as coverage for this AC."
        },
        "determinism": {
          "enum": ["deterministic", "nonDeterministic"],
          "description": "Whether the AC's observable output is deterministic (same inputs, same outputs) or non-deterministic (LLM-generated text, ranked results, generated code, judgement calls). Optional at schema level; absence is treated as 'deterministic' by every consumer. Governs whether an EVAL is required by rcf audit eval coverage --strict and whether the merge gate emits EVAL-MISSING or EVAL-BELOW-THRESHOLD per-AC verdicts."
        },
        "ownerRef": { "$ref": "#/$defs/acOwnerRef" },
        "disposition": { "$ref": "#/$defs/acDisposition" },
        "vendorCitation": { "$ref": "#/$defs/acVendorCitation" },
        "probe": { "$ref": "#/$defs/acProbe" },
        "provenance": { "$ref": "#/$defs/acProvenance" }
      }
    },
    "acOwnerRef": {
      "type": "object",
      "additionalProperties": false,
      "properties": {
        "tacId": { "$ref": "https://schemas.stravica.io/rcf/v0.6.0/common.schema.json#/$defs/tacId" },
        "adrId": { "$ref": "https://schemas.stravica.io/rcf/v0.6.0/common.schema.json#/$defs/adrId" },
        "field": {
          "type": "string",
          "minLength": 1,
          "description": "Optional dotted path into the owning TAC or ADR record (for example, 'interfaces.principal.fields' or 'decision.retryPolicy') that pinpoints the referenced surface. Optional; presence is not enforced."
        }
      },
      "description": "Optional back-reference on an acceptance criterion naming the owning TAC or ADR the criterion observes rather than restating. All sub-fields are optional at schema level so the record composes additively; ruleset-enforcing consumers may require at least one of tacId or adrId when the criterion references an owning artefact."
    },
    "acDisposition": {
      "enum": ["fixed", "template"],
      "description": "Marks whether an acceptance criterion is the blueprint's to fix (mechanism-invariant, inherited unchanged by every applying project) or the applying agent's to set (project-parameterised, shape-given and value-open). Optional at schema level; consumer rulesets that gate blueprint contributions may require it on every AC of a shipped blueprint. Absence carries no default: a consumer that requires the marker treats an unmarked AC as a defect, and a consumer that does not require it ignores the absence."
    },
    "acVendorCitation": {
      "type": "object",
      "additionalProperties": false,
      "required": ["url", "verifiedOn"],
      "properties": {
        "url": {
          "type": "string",
          "format": "uri",
          "minLength": 1,
          "description": "Vendor documentation URL the third-party fact rests on. Consumers may fetch it at gate time so a dead link is a finding."
        },
        "verifiedOn": {
          "type": "string",
          "format": "date",
          "description": "ISO-8601 date (YYYY-MM-DD) the vendor fact was verified against the cited URL. Consumers compare against their own tolerance window and refuse or warn when the citation is beyond it."
        }
      },
      "description": "Vendor citation for an acceptance criterion whose truth rests on a third-party platform fact. Optional at schema level; consumer rulesets may require it on any AC that asserts a vendor fact (for example, a platform migration keyword or a rate-limit value)."
    },
    "acProbe": {
      "type": "object",
      "additionalProperties": false,
      "required": ["path"],
      "properties": {
        "method": {
          "type": "string",
          "enum": ["GET", "HEAD", "POST", "PUT", "PATCH", "DELETE", "OPTIONS"],
          "description": "HTTP method of the probe request. Optional; absence means GET."
        },
        "path": {
          "type": "string",
          "minLength": 1,
          "description": "URL path the probe requests, relative to the run's --url (for example /healthz or /api/notes?limit=1). The only required field."
        },
        "expectStatus": {
          "type": "integer",
          "minimum": 100,
          "maximum": 599,
          "description": "HTTP status code the response must carry."
        },
        "expectHeader": { "$ref": "#/$defs/acProbeExpectHeader" },
        "expectBody": { "$ref": "#/$defs/acProbeExpectBody" },
        "selector": {
          "type": "string",
          "minLength": 1,
          "pattern": "\\S",
          "description": "DOM selector that must be present in the rendered response. At least one non-whitespace character is required."
        },
        "parityEnv": {
          "type": "string",
          "minLength": 1,
          "description": "Target environment the probe is scoped to; the consuming resolver pairs it with rcf verify run --parity-env."
        }
      },
      "description": "Deterministic per-AC probe resolved by rcf verify run (rcf-lite issue 349). Absent means the criterion stays critique-only. Shape follows the Probe record in rcf-lite TAC-4150; the schema constrains shape only and the resolution semantics belong to the consumer."
    },
    "acProbeExpectHeader": {
      "type": "object",
      "additionalProperties": false,
      "required": ["name", "match"],
      "properties": {
        "name": {
          "type": "string",
          "minLength": 1,
          "pattern": "\\S",
          "description": "Response header name. At least one non-whitespace character is required."
        },
        "match": {
          "type": "string",
          "minLength": 1,
          "pattern": "\\S",
          "description": "Value the named header must match. Match semantics belong to the consuming resolver. At least one non-whitespace character is required."
        }
      },
      "description": "Response header assertion on an acceptance-criterion probe. Both name and match are required."
    },
    "acProbeExpectBody": {
      "type": "object",
      "additionalProperties": false,
      "properties": {
        "contains": {
          "type": "string",
          "minLength": 1,
          "pattern": "\\S",
          "description": "Literal text the response body must contain. At least one non-whitespace character is required."
        },
        "matches": {
          "type": "string",
          "minLength": 1,
          "pattern": "\\S",
          "description": "Regular expression source the response body must match. At least one non-whitespace character is required."
        }
      },
      "minProperties": 1,
      "maxProperties": 1,
      "description": "Response body assertion on an acceptance-criterion probe. Exactly one of contains or matches: the object is closed to those two properties and carries exactly one of them."
    },
    "acProvenance": {
      "type": "object",
      "additionalProperties": false,
      "required": ["authoredBy"],
      "properties": {
        "authoredBy": {
          "enum": ["operator", "baseline", "operatorEdited"],
          "description": "Origin of the acceptance criterion. operator: hand-authored. baseline: injected by the shape-baseline sweep. operatorEdited: baseline entry the operator later edited in place; the baselineKey still traces so opt-outs remain linkable."
        },
        "baselineKey": {
          "type": "string",
          "minLength": 1,
          "description": "Catalogue key naming the baseline entry (for example webUi.sharedNav, auth.htmlLoginPage). Required in practice when authoredBy is baseline or operatorEdited."
        },
        "injectedAt": { "$ref": "https://schemas.stravica.io/rcf/v0.6.0/common.schema.json#/$defs/timestamp" },
        "sourceReqShape": {
          "enum": ["webUi", "httpApi", "auth", "persistence", "notifications"],
          "description": "Which parent-requirement shape triggered the injection."
        },
        "acceptedByOperatorAt": { "$ref": "https://schemas.stravica.io/rcf/v0.6.0/common.schema.json#/$defs/timestamp" }
      },
      "description": "Provenance for an acceptance criterion. Downstream consumers of acceptance criteria treat baseline and operator entries identically; this block is provenance only."
    }
  }
}
