{
  "usId": "US-1201",
  "prdId": "PRD-001",
  "reqId": "REQ-012",
  "version": "0.1.0",
  "status": "draft",
  "title": "Signed-in owner reaches dashboard",
  "asA": "signed-in owner",
  "iWant": "to land on the dashboard after logging in",
  "soThat": "I can see every monitor's status at a glance",
  "acceptanceCriteria": [
    {
      "id": "AC-1201-1",
      "description": "any authenticated route renders the shared nav",
      "given": "the user is signed in",
      "when": "any authenticated route is loaded",
      "then": "the response HTML contains the shared nav element with aria-current on the matching link",
      "testable": true,
      "provenance": {
        "authoredBy": "baseline",
        "baselineKey": "webUi.sharedNav",
        "injectedAt": "2026-07-30T14:22:00Z",
        "sourceReqShape": "webUi",
        "acceptedByOperatorAt": "2026-07-30T14:25:00Z"
      }
    },
    {
      "id": "AC-1201-2",
      "description": "operator's own hand-authored acceptance criterion",
      "given": "the dashboard has loaded",
      "when": "the operator clicks a monitor tile",
      "then": "the tile expands into a detail view",
      "testable": true,
      "provenance": {
        "authoredBy": "operator"
      }
    }
  ],
  "createdAt": "2026-07-30T14:20:00Z",
  "updatedAt": "2026-07-30T14:25:00Z"
}
