{
  "usId": "US-302",
  "prdId": "PRD-100",
  "reqId": "REQ-302",
  "version": "1.0.0",
  "status": "approved",
  "title": "Probe expectBody.contains carries real text with inner whitespace",
  "asA": "operator running deterministic verify",
  "iWant": "a body assertion on literal text that includes spaces",
  "soThat": "a real phrase passes while a whitespace-only string is refused",
  "acceptanceCriteria": [
    {
      "id": "AC-302-1",
      "description": "The home page greets the signed-in user.",
      "testable": true,
      "probe": {
        "path": "/",
        "expectStatus": 200,
        "expectBody": {
          "contains": "Welcome back"
        }
      }
    }
  ],
  "createdAt": "2026-01-01T00:00:00Z",
  "updatedAt": "2026-10-16T00:00:00Z"
}
